{
  "$schema": "https://json-schema.org/draft/2020-12/schema",
  "$id": "https://mathiqo.dev/schemas/item-instance.schema.json",
  "title": "Item Instance",
  "description": "One concrete, dressed, machine-solved item materialized by the Stage 5 bank builder (tools/bank_build.py) from a promoted item-record template (core design doc §3 Stage 5, §5.1, KTD4). Variable assignment, rendered text, the canonical answer, and the complete tagged distractor set are all computed and stored offline, so the Orchestrator only ever selects and looks these up at serve time and never constructs mathematics (§5.1 boundary rule). attempt-event.schema.json's item_instance_id names one of these records. The item-record template schema is untouched — this is a separate, instance-level schema (KTD4).",
  "type": "object",
  "additionalProperties": false,
  "required": [
    "item_instance_id",
    "template_id",
    "template_version",
    "bank_version",
    "variant_signature",
    "graph_version",
    "skill_ids",
    "question_type",
    "difficulty",
    "language",
    "locale",
    "variables",
    "stem",
    "answer",
    "simplest_form_only",
    "distractors",
    "hints",
    "solution_steps"
  ],
  "properties": {
    "item_instance_id": {
      "type": "string",
      "minLength": 1,
      "description": "Unique id for this concrete instance within the bank; the value attempt-event.schema.json's item_instance_id references (§9). Convention: \"<template_id>#<bank_version>#<NNNNN>\", NNNNN the instance's zero-padded rank within its template's sampled pool — see tools/bank_build.py."
    },
    "template_id": {
      "type": "string",
      "pattern": "^TPL\\.[A-Z0-9][A-Z0-9.-]*$",
      "description": "Provenance: the item-record template this instance was materialized from (§3 Stage 5)."
    },
    "template_version": {
      "type": "string",
      "minLength": 1,
      "description": "Copied from the source template at materialization time; carried forward onto the attempt event unchanged (§5.3, §9)."
    },
    "bank_version": {
      "type": "string",
      "minLength": 1,
      "description": "The atomic bank build this instance ships in (§3 Stage 5). Banks are never patched in place — a new build gets a new bank_version and a new instance set."
    },
    "variant_signature": {
      "type": "string",
      "pattern": "^[0-9a-f]{64}$",
      "description": "Serving-integrity contract R8/R9, KTD1: sha256 hex digest over canonical JSON of (template_id, template_version, variables) — an identity for what the student actually sees, equal across bank builds when the rendered item is the same (core doc §5.3-§5.4). Excludes stem, locale, dressing, language, rank, and bank_version, which all rotate or change across rebuilds independent of content. Produced once here at bank-build time; consumers and the serving layer never compute it independently."
    },
    "graph_version": {
      "type": "string",
      "minLength": 1,
      "description": "Copied from the source template: the skill graph version it was authored against (§5.3); mastery records carry the same stamp for migration correctness (student-model doc §8)."
    },
    "skill_ids": {
      "type": "array",
      "items": {
        "type": "string",
        "pattern": "^[A-Z][A-Z0-9]*(\\.[A-Z0-9][A-Z0-9-]*)*$"
      },
      "minItems": 1,
      "uniqueItems": true,
      "description": "Copied verbatim from the template (§2.2); the Orchestrator copies this straight onto the attempt event at serve time rather than deriving it (R11)."
    },
    "question_type": {
      "type": "string",
      "enum": ["mcq_4", "numeric_entry"],
      "description": "v1 bank-build scope restriction (core doc §4): the builder hard-refuses every other §2.7 type, naming the offending template. A strict subset of item-record/attempt-event's fuller enum by construction, not a drifted copy of it."
    },
    "difficulty": {
      "type": "number",
      "minimum": 0,
      "maximum": 1,
      "description": "Copied from the template's difficulty scalar D ∈ [0,1] (§2.3)."
    },
    "language": {
      "type": "string",
      "pattern": "^[a-z]{2,3}(-[A-Z]{2})?$",
      "description": "The stem_i18n / hints_i18n / solution_steps_i18n language key this instance was rendered from (§2.8, §9)."
    },
    "locale": {
      "type": "string",
      "minLength": 1,
      "description": "Locale pack used for dressing (§1.5, §9), e.g. \"en-IN\"."
    },
    "variables": {
      "type": "object",
      "additionalProperties": { "type": ["integer", "string"] },
      "minProperties": 1,
      "description": "The concrete variable assignment this instance was generated from (§2.2), e.g. {\"a\": 2, \"b\": 4, \"c\": 1, \"d\": 3}. v1 enumerates only int-typed variables (tools/item_verify.py build_domains); string kept in the type union for forward compatibility with the item-record schema's variable type surface."
    },
    "stem": {
      "type": "string",
      "minLength": 1,
      "description": "The fully rendered question stem: every {{variable}} and every localization slot substituted. Nothing is left to resolve at serve time (§5.1, R11)."
    },
    "answer": {
      "type": "string",
      "minLength": 1,
      "pattern": "^-?\\d+(/\\d+)?$",
      "description": "The exact answer as a canonical rational string, \"p/q\" (q > 1, reduced) or \"p\" (whole number) — computed once offline by exact symbolic evaluation (§2.2, §3 Stage 3), never re-derived at serve time."
    },
    "simplest_form_only": {
      "type": "boolean",
      "description": "Normalized from the template's free-text accepted_answer_forms (KTD8): true iff that field starts with \"simplest form only\" (case-insensitive), false when the field is absent or phrased otherwise. Grading reads this flag, never the template's free text."
    },
    "distractors": {
      "type": "array",
      "items": {
        "type": "object",
        "additionalProperties": false,
        "required": ["value", "misconception_id", "unsimplified"],
        "properties": {
          "value": {
            "type": "string",
            "minLength": 1,
            "pattern": "^-?\\d+(/\\d+)?$",
            "description": "The distractor's displayed value: a reduced \"p/q\"/\"p\" string, or — when unsimplified is true — the literal unreduced numerator/denominator split that shares the answer's value while displaying differently (§2.2, §3 Stage 3 \"displayed form\" convention)."
          },
          "misconception_id": {
            "type": ["string", "null"],
            "pattern": "^MISC\\.[A-Z0-9][A-Z0-9.-]*$",
            "description": "Registry tag this distractor is designed to expose, or null when untagged (§2.4-2.5)."
          },
          "unsimplified": {
            "type": "boolean",
            "description": "True when value is the literal unreduced numerator/denominator split rather than a reduced rational (§2.2)."
          }
        }
      },
      "description": "The full offered-for-this-variant distractor set: only_if-guarded distractors that didn't fire are already excluded, and this variant was dropped entirely (never materialized) if any offered distractor collided with the answer or with another offered distractor (§3 Stage 3, R8). For mcq_4 this is the on-screen option set; for numeric_entry the identical shape is stored, unrendered, for wrong-answer matching only (§5.1 bank requirement, R9)."
    },
    "hints": {
      "type": "array",
      "items": { "type": "string", "minLength": 1 },
      "minItems": 1,
      "description": "The rendered hint ladder, lightest to strongest, in serve order (§2.2, §2.3) — fully substituted offline (R11)."
    },
    "solution_steps": {
      "type": "object",
      "minProperties": 1,
      "additionalProperties": {
        "type": "array",
        "items": { "type": "string", "minLength": 1 },
        "minItems": 1
      },
      "description": "Rendered solution steps keyed by pedagogy variant (\"canonical\", \"NCERT\", ...), mirroring the template's solution_steps_i18n[language] (§2.2) — fully substituted offline (R11)."
    },
    "figures": {
      "type": ["array", "null"],
      "minItems": 1,
      "items": { "$ref": "#/$defs/figure" },
      "description": "The materialized visual stimulus, or null when this item has none. Every instance built after figure support shipped carries the key explicitly; instances from earlier banks omit it entirely, which is why this property is optional rather than required. Values are concrete — every expression already evaluated and every label already rendered into this instance's language and dressing, so a consumer draws the figure without resolving anything (§5.1, R11). The stem still describes the figure in words, so a consumer that ignores this field can answer the item unchanged."
    }
  },
  "$defs": {
    "value": {
      "oneOf": [
        { "type": "integer" },
        { "type": "string", "pattern": "^-?\\d+(/\\d+)?$" }
      ],
      "description": "A materialized figure quantity: a plain integer, or an exact rational as \"p/q\" following the same convention as answer. Never a float — figure positions like thirds must stay exact."
    },
    "figure": {
      "oneOf": [
        { "$ref": "#/$defs/figBarGraph" },
        { "$ref": "#/$defs/figPictograph" },
        { "$ref": "#/$defs/figTallyChart" },
        { "$ref": "#/$defs/figNumberLine" },
        { "$ref": "#/$defs/figAngle" },
        { "$ref": "#/$defs/figCircle" },
        { "$ref": "#/$defs/figPointLine" },
        { "$ref": "#/$defs/figShape" },
        { "$ref": "#/$defs/figRegion" },
        { "$ref": "#/$defs/figArray" },
        { "$ref": "#/$defs/figGridRegion" },
        { "$ref": "#/$defs/figRuler" }
      ],
      "description": "One materialized figure, discriminated by kind — the concrete counterpart of item-record.schema.json's figureSpec. Twelve kinds cover the Class 6 census."
    },
    "figBarGraph": {
      "type": "object",
      "additionalProperties": false,
      "required": ["kind", "scale", "bars"],
      "properties": {
        "kind": { "const": "bar-graph" },
        "scale": { "$ref": "#/$defs/value", "description": "Value represented by one gridline." },
        "unit": { "type": "string", "minLength": 1 },
        "bars": {
          "type": "array",
          "minItems": 1,
          "items": {
            "type": "object",
            "additionalProperties": false,
            "required": ["label", "gridlines"],
            "properties": {
              "label": { "type": "string", "minLength": 1 },
              "gridlines": { "$ref": "#/$defs/value" }
            }
          }
        }
      }
    },
    "figPictograph": {
      "type": "object",
      "additionalProperties": false,
      "required": ["kind", "key", "rows"],
      "properties": {
        "kind": { "const": "pictograph" },
        "key": { "$ref": "#/$defs/value" },
        "unit": { "type": "string", "minLength": 1 },
        "icon": { "type": "string", "minLength": 1 },
        "rows": {
          "type": "array",
          "minItems": 1,
          "items": {
            "type": "object",
            "additionalProperties": false,
            "required": ["label", "whole"],
            "properties": {
              "label": { "type": "string", "minLength": 1 },
              "whole": { "$ref": "#/$defs/value" },
              "half": { "type": "boolean", "description": "A trailing half-clipped symbol worth key/2." }
            }
          }
        }
      }
    },
    "figTallyChart": {
      "type": "object",
      "additionalProperties": false,
      "required": ["kind", "rows"],
      "properties": {
        "kind": { "const": "tally-chart" },
        "rows": {
          "type": "array",
          "minItems": 1,
          "items": {
            "type": "object",
            "additionalProperties": false,
            "required": ["label", "bundles", "loose"],
            "properties": {
              "label": { "type": "string", "minLength": 1 },
              "bundles": { "$ref": "#/$defs/value" },
              "loose": { "$ref": "#/$defs/value" }
            }
          }
        }
      }
    },
    "figNumberLine": {
      "type": "object",
      "additionalProperties": false,
      "required": ["kind", "min", "max", "divisions", "points"],
      "properties": {
        "kind": { "const": "number-line" },
        "min": { "$ref": "#/$defs/value" },
        "max": { "$ref": "#/$defs/value" },
        "divisions": { "$ref": "#/$defs/value" },
        "points": {
          "type": "array",
          "minItems": 1,
          "items": {
            "type": "object",
            "additionalProperties": false,
            "required": ["position"],
            "properties": {
              "position": { "$ref": "#/$defs/value" },
              "label": { "type": "string", "minLength": 1 }
            }
          }
        }
      }
    },
    "figAngle": {
      "type": "object",
      "additionalProperties": false,
      "required": ["kind", "degrees", "context"],
      "properties": {
        "kind": { "const": "angle" },
        "degrees": { "$ref": "#/$defs/value" },
        "context": { "enum": ["bare", "clock", "protractor", "reflex"] },
        "scale": { "enum": ["inner", "outer"] },
        "tilt": { "$ref": "#/$defs/value" },
        "arm_length": { "$ref": "#/$defs/value" },
        "count": { "$ref": "#/$defs/value", "description": "Draw this angle count times at differing tilts." }
      }
    },
    "figCircle": {
      "type": "object",
      "additionalProperties": false,
      "required": ["kind"],
      "properties": {
        "kind": { "const": "circle" },
        "construction": { "enum": ["none", "segment-as-diameter"] },
        "length_part": { "enum": ["radius", "diameter"] },
        "length": { "$ref": "#/$defs/value" },
        "unit": { "type": "string", "minLength": 1 },
        "points_on": { "$ref": "#/$defs/value" },
        "points_off": { "$ref": "#/$defs/value" }
      }
    },
    "figPointLine": {
      "type": "object",
      "additionalProperties": false,
      "required": ["kind", "elements"],
      "properties": {
        "kind": { "const": "point-line" },
        "collinear": { "type": "boolean" },
        "elements": {
          "type": "array",
          "minItems": 1,
          "items": {
            "type": "object",
            "additionalProperties": false,
            "required": ["element", "count"],
            "properties": {
              "element": { "enum": ["point", "segment", "ray", "line"] },
              "count": { "$ref": "#/$defs/value" },
              "labels": { "type": "array", "items": { "type": "string", "minLength": 1 } }
            }
          }
        }
      }
    },
    "figShape": {
      "type": "object",
      "additionalProperties": false,
      "required": ["kind", "shape"],
      "properties": {
        "kind": { "const": "shape" },
        "shape": { "enum": ["rectangle", "square", "triangle", "isosceles-triangle", "parallelogram", "pentagon", "regular-ngon", "circle", "prism", "composite-l"] },
        "sides": { "$ref": "#/$defs/value" },
        "vertex_labels": { "type": "array", "items": { "type": "string", "minLength": 1 } },
        "side_labels": {
          "type": "array",
          "items": {
            "type": "object",
            "additionalProperties": false,
            "required": ["side", "value"],
            "properties": {
              "side": { "type": "integer", "minimum": 0 },
              "value": { "$ref": "#/$defs/value" },
              "unit": { "type": "string", "minLength": 1 }
            }
          },
          "description": "Only the sides the item states are labelled; some items turn on a side being unlabelled."
        },
        "rotation": { "$ref": "#/$defs/value" },
        "symmetry": { "enum": ["none", "lines", "order"] }
      }
    },
    "figRegion": {
      "type": "object",
      "additionalProperties": false,
      "required": ["kind", "shape", "parts"],
      "properties": {
        "kind": { "const": "region" },
        "shape": { "enum": ["bar", "rectangle", "circle"] },
        "parts": {
          "type": "array",
          "minItems": 2,
          "items": {
            "type": "object",
            "additionalProperties": false,
            "required": ["weight", "shaded"],
            "properties": {
              "weight": { "$ref": "#/$defs/value", "description": "Relative size; parts are unequal wherever the item depends on it." },
              "shaded": { "type": "boolean" }
            }
          }
        }
      }
    },
    "figArray": {
      "type": "object",
      "additionalProperties": false,
      "required": ["kind", "rows"],
      "properties": {
        "kind": { "const": "array" },
        "rows": {
          "type": "array",
          "minItems": 1,
          "items": { "$ref": "#/$defs/value" },
          "description": "Marks per row, already expanded from the template's row-index expression."
        },
        "icon": { "type": "string", "minLength": 1 }
      }
    },
    "figGridRegion": {
      "type": "object",
      "additionalProperties": false,
      "required": ["kind", "cols", "rows", "fill"],
      "properties": {
        "kind": { "const": "grid-region" },
        "cols": { "$ref": "#/$defs/value" },
        "rows": { "$ref": "#/$defs/value" },
        "fill": { "enum": ["all", "block-minus-corner", "half-squares"] },
        "cutout_cols": { "$ref": "#/$defs/value" },
        "cutout_rows": { "$ref": "#/$defs/value" },
        "half_cells": { "$ref": "#/$defs/value" }
      }
    },
    "figRuler": {
      "type": "object",
      "additionalProperties": false,
      "required": ["kind", "min", "max", "major", "minor", "unit", "objects"],
      "properties": {
        "kind": { "const": "ruler" },
        "min": { "$ref": "#/$defs/value" },
        "max": { "$ref": "#/$defs/value" },
        "major": { "$ref": "#/$defs/value" },
        "minor": { "$ref": "#/$defs/value" },
        "unit": { "type": "string", "minLength": 1 },
        "objects": {
          "type": "array",
          "minItems": 1,
          "items": {
            "type": "object",
            "additionalProperties": false,
            "required": ["start", "end"],
            "properties": {
              "label": { "type": "string", "minLength": 1 },
              "start": { "$ref": "#/$defs/value" },
              "end": { "$ref": "#/$defs/value" }
            }
          }
        }
      }
    }
  }
}
