[
  {
    "answer": "1000",
    "bank_version": "v1",
    "difficulty": 0.5,
    "distractors": [],
    "figures": null,
    "graph_version": "1.0.0",
    "hints": [
      "How many metres are in 1 kilometre?",
      "Multiply the number of kilometres by 1000."
    ],
    "item_instance_id": "TPL.MEASLENGTH.CONVERT.KM.TO.M.001#v1#00000",
    "language": "en-IN",
    "locale": "en-IN",
    "question_type": "numeric_entry",
    "simplest_form_only": false,
    "skill_ids": [
      "MEAS.LENGTH.UNITS"
    ],
    "solution_steps": {
      "canonical": [
        "Every kilometre is 1000 metres.",
        "1 x 1000 = the road's length in metres."
      ]
    },
    "stem": "A road is 1 kilometres long. Since 1 kilometre = 1000 metres, how long is the road in metres?",
    "template_id": "TPL.MEASLENGTH.CONVERT.KM.TO.M.001",
    "template_version": "1.0.0",
    "variables": {
      "k": 1
    },
    "variant_signature": "7253afbcd8944c4beb5d26e9d1eaaba032af403a20b86457035488d715648c3a"
  },
  {
    "answer": "2000",
    "bank_version": "v1",
    "difficulty": 0.5,
    "distractors": [],
    "figures": null,
    "graph_version": "1.0.0",
    "hints": [
      "How many metres are in 1 kilometre?",
      "Multiply the number of kilometres by 1000."
    ],
    "item_instance_id": "TPL.MEASLENGTH.CONVERT.KM.TO.M.001#v1#00001",
    "language": "en-IN",
    "locale": "en-IN",
    "question_type": "numeric_entry",
    "simplest_form_only": false,
    "skill_ids": [
      "MEAS.LENGTH.UNITS"
    ],
    "solution_steps": {
      "canonical": [
        "Every kilometre is 1000 metres.",
        "2 x 1000 = the road's length in metres."
      ]
    },
    "stem": "A road is 2 kilometres long. Since 1 kilometre = 1000 metres, how long is the road in metres?",
    "template_id": "TPL.MEASLENGTH.CONVERT.KM.TO.M.001",
    "template_version": "1.0.0",
    "variables": {
      "k": 2
    },
    "variant_signature": "829ae8cce6443a13476ce97224816a7888eb3e0d4a3846383c73ef0d7b531f69"
  },
  {
    "answer": "3000",
    "bank_version": "v1",
    "difficulty": 0.5,
    "distractors": [],
    "figures": null,
    "graph_version": "1.0.0",
    "hints": [
      "How many metres are in 1 kilometre?",
      "Multiply the number of kilometres by 1000."
    ],
    "item_instance_id": "TPL.MEASLENGTH.CONVERT.KM.TO.M.001#v1#00002",
    "language": "en-IN",
    "locale": "en-IN",
    "question_type": "numeric_entry",
    "simplest_form_only": false,
    "skill_ids": [
      "MEAS.LENGTH.UNITS"
    ],
    "solution_steps": {
      "canonical": [
        "Every kilometre is 1000 metres.",
        "3 x 1000 = the road's length in metres."
      ]
    },
    "stem": "A road is 3 kilometres long. Since 1 kilometre = 1000 metres, how long is the road in metres?",
    "template_id": "TPL.MEASLENGTH.CONVERT.KM.TO.M.001",
    "template_version": "1.0.0",
    "variables": {
      "k": 3
    },
    "variant_signature": "eb8487738724971a8157a1ca2b4bf28e4f9f3e38153fb0fe51d3ab4dfbb841ca"
  },
  {
    "answer": "4000",
    "bank_version": "v1",
    "difficulty": 0.5,
    "distractors": [],
    "figures": null,
    "graph_version": "1.0.0",
    "hints": [
      "How many metres are in 1 kilometre?",
      "Multiply the number of kilometres by 1000."
    ],
    "item_instance_id": "TPL.MEASLENGTH.CONVERT.KM.TO.M.001#v1#00003",
    "language": "en-IN",
    "locale": "en-IN",
    "question_type": "numeric_entry",
    "simplest_form_only": false,
    "skill_ids": [
      "MEAS.LENGTH.UNITS"
    ],
    "solution_steps": {
      "canonical": [
        "Every kilometre is 1000 metres.",
        "4 x 1000 = the road's length in metres."
      ]
    },
    "stem": "A road is 4 kilometres long. Since 1 kilometre = 1000 metres, how long is the road in metres?",
    "template_id": "TPL.MEASLENGTH.CONVERT.KM.TO.M.001",
    "template_version": "1.0.0",
    "variables": {
      "k": 4
    },
    "variant_signature": "951c1904adaba7cc3f81ba7dd8912c8b1f2e93928b3bce494b82d62055e06a3d"
  },
  {
    "answer": "5000",
    "bank_version": "v1",
    "difficulty": 0.5,
    "distractors": [],
    "figures": null,
    "graph_version": "1.0.0",
    "hints": [
      "How many metres are in 1 kilometre?",
      "Multiply the number of kilometres by 1000."
    ],
    "item_instance_id": "TPL.MEASLENGTH.CONVERT.KM.TO.M.001#v1#00004",
    "language": "en-IN",
    "locale": "en-IN",
    "question_type": "numeric_entry",
    "simplest_form_only": false,
    "skill_ids": [
      "MEAS.LENGTH.UNITS"
    ],
    "solution_steps": {
      "canonical": [
        "Every kilometre is 1000 metres.",
        "5 x 1000 = the road's length in metres."
      ]
    },
    "stem": "A road is 5 kilometres long. Since 1 kilometre = 1000 metres, how long is the road in metres?",
    "template_id": "TPL.MEASLENGTH.CONVERT.KM.TO.M.001",
    "template_version": "1.0.0",
    "variables": {
      "k": 5
    },
    "variant_signature": "7d515bddeb51266ef24fb754e24598f7a062308a5207c89a8b37dd329a3e9bf3"
  },
  {
    "answer": "6000",
    "bank_version": "v1",
    "difficulty": 0.5,
    "distractors": [],
    "figures": null,
    "graph_version": "1.0.0",
    "hints": [
      "How many metres are in 1 kilometre?",
      "Multiply the number of kilometres by 1000."
    ],
    "item_instance_id": "TPL.MEASLENGTH.CONVERT.KM.TO.M.001#v1#00005",
    "language": "en-IN",
    "locale": "en-IN",
    "question_type": "numeric_entry",
    "simplest_form_only": false,
    "skill_ids": [
      "MEAS.LENGTH.UNITS"
    ],
    "solution_steps": {
      "canonical": [
        "Every kilometre is 1000 metres.",
        "6 x 1000 = the road's length in metres."
      ]
    },
    "stem": "A road is 6 kilometres long. Since 1 kilometre = 1000 metres, how long is the road in metres?",
    "template_id": "TPL.MEASLENGTH.CONVERT.KM.TO.M.001",
    "template_version": "1.0.0",
    "variables": {
      "k": 6
    },
    "variant_signature": "b6e8028be97902ae9282e0b801cc28840e2c285d7550c9d836fb5b299800f4b0"
  },
  {
    "answer": "7000",
    "bank_version": "v1",
    "difficulty": 0.5,
    "distractors": [],
    "figures": null,
    "graph_version": "1.0.0",
    "hints": [
      "How many metres are in 1 kilometre?",
      "Multiply the number of kilometres by 1000."
    ],
    "item_instance_id": "TPL.MEASLENGTH.CONVERT.KM.TO.M.001#v1#00006",
    "language": "en-IN",
    "locale": "en-IN",
    "question_type": "numeric_entry",
    "simplest_form_only": false,
    "skill_ids": [
      "MEAS.LENGTH.UNITS"
    ],
    "solution_steps": {
      "canonical": [
        "Every kilometre is 1000 metres.",
        "7 x 1000 = the road's length in metres."
      ]
    },
    "stem": "A road is 7 kilometres long. Since 1 kilometre = 1000 metres, how long is the road in metres?",
    "template_id": "TPL.MEASLENGTH.CONVERT.KM.TO.M.001",
    "template_version": "1.0.0",
    "variables": {
      "k": 7
    },
    "variant_signature": "ea3301b60434d4a116fafb03786e3aa98bfd207acc2a2f3c72941185515d4823"
  },
  {
    "answer": "8000",
    "bank_version": "v1",
    "difficulty": 0.5,
    "distractors": [],
    "figures": null,
    "graph_version": "1.0.0",
    "hints": [
      "How many metres are in 1 kilometre?",
      "Multiply the number of kilometres by 1000."
    ],
    "item_instance_id": "TPL.MEASLENGTH.CONVERT.KM.TO.M.001#v1#00007",
    "language": "en-IN",
    "locale": "en-IN",
    "question_type": "numeric_entry",
    "simplest_form_only": false,
    "skill_ids": [
      "MEAS.LENGTH.UNITS"
    ],
    "solution_steps": {
      "canonical": [
        "Every kilometre is 1000 metres.",
        "8 x 1000 = the road's length in metres."
      ]
    },
    "stem": "A road is 8 kilometres long. Since 1 kilometre = 1000 metres, how long is the road in metres?",
    "template_id": "TPL.MEASLENGTH.CONVERT.KM.TO.M.001",
    "template_version": "1.0.0",
    "variables": {
      "k": 8
    },
    "variant_signature": "c98e603687c602de72b6abe9aa0892034dbc2c61f8bafb5678d554e4236a79b0"
  },
  {
    "answer": "9000",
    "bank_version": "v1",
    "difficulty": 0.5,
    "distractors": [],
    "figures": null,
    "graph_version": "1.0.0",
    "hints": [
      "How many metres are in 1 kilometre?",
      "Multiply the number of kilometres by 1000."
    ],
    "item_instance_id": "TPL.MEASLENGTH.CONVERT.KM.TO.M.001#v1#00008",
    "language": "en-IN",
    "locale": "en-IN",
    "question_type": "numeric_entry",
    "simplest_form_only": false,
    "skill_ids": [
      "MEAS.LENGTH.UNITS"
    ],
    "solution_steps": {
      "canonical": [
        "Every kilometre is 1000 metres.",
        "9 x 1000 = the road's length in metres."
      ]
    },
    "stem": "A road is 9 kilometres long. Since 1 kilometre = 1000 metres, how long is the road in metres?",
    "template_id": "TPL.MEASLENGTH.CONVERT.KM.TO.M.001",
    "template_version": "1.0.0",
    "variables": {
      "k": 9
    },
    "variant_signature": "2944a5267939353e5622ee51fcddff2db445a023050c72beb530d769d4996a27"
  }
]
