[
  {
    "answer": "6",
    "bank_version": "v1",
    "difficulty": 0.5,
    "distractors": [
      {
        "misconception_id": "MISC.GEO.ROTATED-NOT-SAME",
        "unsimplified": false,
        "value": "0"
      },
      {
        "misconception_id": null,
        "unsimplified": false,
        "value": "3"
      },
      {
        "misconception_id": null,
        "unsimplified": false,
        "value": "4"
      }
    ],
    "figures": [
      {
        "kind": "shape",
        "rotation": 120,
        "shape": "triangle"
      }
    ],
    "graph_version": "1.0.0",
    "hints": [
      "Count the sides and corners after the turn \u2014 did either number change?",
      "A shape's sides and corners depend on the shape itself, not which way it is facing."
    ],
    "item_instance_id": "TPL.GEO.SHAPES2D.ROTATE.TRIANGLE.001#v1#00000",
    "language": "en-IN",
    "locale": "en-IN",
    "question_type": "mcq_4",
    "simplest_form_only": false,
    "skill_ids": [
      "GEO.SHAPES.2D"
    ],
    "solution_steps": {
      "canonical": [
        "Turning the triangle changes which way it points, but not its sides or corners.",
        "It still has 3 sides and 3 corners, so 3 + 3 = 6 altogether."
      ]
    },
    "stem": "A triangle has 3 straight sides and 3 corners. It is rotated 1 times, a third of a full turn each time, so its point ends up facing a different way. How many sides and corners does it have now, added together?",
    "template_id": "TPL.GEO.SHAPES2D.ROTATE.TRIANGLE.001",
    "template_version": "1.0.0",
    "variables": {
      "n": 1
    },
    "variant_signature": "d15675dd13b0fb3186592a356e25a7c4e4d365e598e927cf551dcaa4ec3134ba"
  },
  {
    "answer": "6",
    "bank_version": "v1",
    "difficulty": 0.5,
    "distractors": [
      {
        "misconception_id": "MISC.GEO.ROTATED-NOT-SAME",
        "unsimplified": false,
        "value": "0"
      },
      {
        "misconception_id": null,
        "unsimplified": false,
        "value": "3"
      },
      {
        "misconception_id": null,
        "unsimplified": false,
        "value": "4"
      }
    ],
    "figures": [
      {
        "kind": "shape",
        "rotation": 240,
        "shape": "triangle"
      }
    ],
    "graph_version": "1.0.0",
    "hints": [
      "Count the sides and corners after the turn \u2014 did either number change?",
      "A shape's sides and corners depend on the shape itself, not which way it is facing."
    ],
    "item_instance_id": "TPL.GEO.SHAPES2D.ROTATE.TRIANGLE.001#v1#00001",
    "language": "en-IN",
    "locale": "en-IN",
    "question_type": "mcq_4",
    "simplest_form_only": false,
    "skill_ids": [
      "GEO.SHAPES.2D"
    ],
    "solution_steps": {
      "canonical": [
        "Turning the triangle changes which way it points, but not its sides or corners.",
        "It still has 3 sides and 3 corners, so 3 + 3 = 6 altogether."
      ]
    },
    "stem": "A triangle has 3 straight sides and 3 corners. It is rotated 2 times, a third of a full turn each time, so its point ends up facing a different way. How many sides and corners does it have now, added together?",
    "template_id": "TPL.GEO.SHAPES2D.ROTATE.TRIANGLE.001",
    "template_version": "1.0.0",
    "variables": {
      "n": 2
    },
    "variant_signature": "ccfc87930b720801b82f385838233e19d4f234bcfe7349c67faf5240024bfeb6"
  },
  {
    "answer": "6",
    "bank_version": "v1",
    "difficulty": 0.5,
    "distractors": [
      {
        "misconception_id": "MISC.GEO.ROTATED-NOT-SAME",
        "unsimplified": false,
        "value": "0"
      },
      {
        "misconception_id": null,
        "unsimplified": false,
        "value": "3"
      },
      {
        "misconception_id": null,
        "unsimplified": false,
        "value": "4"
      }
    ],
    "figures": [
      {
        "kind": "shape",
        "rotation": 360,
        "shape": "triangle"
      }
    ],
    "graph_version": "1.0.0",
    "hints": [
      "Count the sides and corners after the turn \u2014 did either number change?",
      "A shape's sides and corners depend on the shape itself, not which way it is facing."
    ],
    "item_instance_id": "TPL.GEO.SHAPES2D.ROTATE.TRIANGLE.001#v1#00002",
    "language": "en-IN",
    "locale": "en-IN",
    "question_type": "mcq_4",
    "simplest_form_only": false,
    "skill_ids": [
      "GEO.SHAPES.2D"
    ],
    "solution_steps": {
      "canonical": [
        "Turning the triangle changes which way it points, but not its sides or corners.",
        "It still has 3 sides and 3 corners, so 3 + 3 = 6 altogether."
      ]
    },
    "stem": "A triangle has 3 straight sides and 3 corners. It is rotated 3 times, a third of a full turn each time, so its point ends up facing a different way. How many sides and corners does it have now, added together?",
    "template_id": "TPL.GEO.SHAPES2D.ROTATE.TRIANGLE.001",
    "template_version": "1.0.0",
    "variables": {
      "n": 3
    },
    "variant_signature": "338bbbc30e608ca5dd1d68f04f5deb60127bfbdd43afcc93cdcc24d5eb8b1e56"
  }
]
