[
  {
    "answer": "100",
    "bank_version": "v1",
    "difficulty": 0.2,
    "distractors": [],
    "figures": null,
    "graph_version": "1.0.0",
    "hints": [
      "How many centimetres are in 1 metre?",
      "Multiply the number of metres by 100."
    ],
    "item_instance_id": "TPL.MEASLENGTH.CONVERT.M.TO.CM.001#v1#00000",
    "language": "en-IN",
    "locale": "en-IN",
    "question_type": "numeric_entry",
    "simplest_form_only": false,
    "skill_ids": [
      "MEAS.LENGTH.UNITS"
    ],
    "solution_steps": {
      "canonical": [
        "Every metre is 100 centimetres.",
        "1 x 100 = the rope's length in cm."
      ]
    },
    "stem": "A rope is 1 metres long. Since 1 metre = 100 centimetres, how long is the rope in centimetres?",
    "template_id": "TPL.MEASLENGTH.CONVERT.M.TO.CM.001",
    "template_version": "1.0.0",
    "variables": {
      "m": 1
    },
    "variant_signature": "003f5d91c3df43dbd799f728e9a60db3fbe56847f95d7d7818b47d3d469be010"
  },
  {
    "answer": "200",
    "bank_version": "v1",
    "difficulty": 0.2,
    "distractors": [],
    "figures": null,
    "graph_version": "1.0.0",
    "hints": [
      "How many centimetres are in 1 metre?",
      "Multiply the number of metres by 100."
    ],
    "item_instance_id": "TPL.MEASLENGTH.CONVERT.M.TO.CM.001#v1#00001",
    "language": "en-IN",
    "locale": "en-IN",
    "question_type": "numeric_entry",
    "simplest_form_only": false,
    "skill_ids": [
      "MEAS.LENGTH.UNITS"
    ],
    "solution_steps": {
      "canonical": [
        "Every metre is 100 centimetres.",
        "2 x 100 = the rope's length in cm."
      ]
    },
    "stem": "A rope is 2 metres long. Since 1 metre = 100 centimetres, how long is the rope in centimetres?",
    "template_id": "TPL.MEASLENGTH.CONVERT.M.TO.CM.001",
    "template_version": "1.0.0",
    "variables": {
      "m": 2
    },
    "variant_signature": "f968598b02a8267c0d814303cd800fb5dfd2d2258de2ef33cc3a6529f319624a"
  },
  {
    "answer": "300",
    "bank_version": "v1",
    "difficulty": 0.2,
    "distractors": [],
    "figures": null,
    "graph_version": "1.0.0",
    "hints": [
      "How many centimetres are in 1 metre?",
      "Multiply the number of metres by 100."
    ],
    "item_instance_id": "TPL.MEASLENGTH.CONVERT.M.TO.CM.001#v1#00002",
    "language": "en-IN",
    "locale": "en-IN",
    "question_type": "numeric_entry",
    "simplest_form_only": false,
    "skill_ids": [
      "MEAS.LENGTH.UNITS"
    ],
    "solution_steps": {
      "canonical": [
        "Every metre is 100 centimetres.",
        "3 x 100 = the rope's length in cm."
      ]
    },
    "stem": "A rope is 3 metres long. Since 1 metre = 100 centimetres, how long is the rope in centimetres?",
    "template_id": "TPL.MEASLENGTH.CONVERT.M.TO.CM.001",
    "template_version": "1.0.0",
    "variables": {
      "m": 3
    },
    "variant_signature": "cc1c9243b73a6e0e1bd30e2d1eb47d89be3f7f29dabca8478e8912d934374f41"
  },
  {
    "answer": "400",
    "bank_version": "v1",
    "difficulty": 0.2,
    "distractors": [],
    "figures": null,
    "graph_version": "1.0.0",
    "hints": [
      "How many centimetres are in 1 metre?",
      "Multiply the number of metres by 100."
    ],
    "item_instance_id": "TPL.MEASLENGTH.CONVERT.M.TO.CM.001#v1#00003",
    "language": "en-IN",
    "locale": "en-IN",
    "question_type": "numeric_entry",
    "simplest_form_only": false,
    "skill_ids": [
      "MEAS.LENGTH.UNITS"
    ],
    "solution_steps": {
      "canonical": [
        "Every metre is 100 centimetres.",
        "4 x 100 = the rope's length in cm."
      ]
    },
    "stem": "A rope is 4 metres long. Since 1 metre = 100 centimetres, how long is the rope in centimetres?",
    "template_id": "TPL.MEASLENGTH.CONVERT.M.TO.CM.001",
    "template_version": "1.0.0",
    "variables": {
      "m": 4
    },
    "variant_signature": "1d30d538fd7b7d76422f1f49262575d5dcd0e165f19688c6fba6d01fbdc43eea"
  },
  {
    "answer": "500",
    "bank_version": "v1",
    "difficulty": 0.2,
    "distractors": [],
    "figures": null,
    "graph_version": "1.0.0",
    "hints": [
      "How many centimetres are in 1 metre?",
      "Multiply the number of metres by 100."
    ],
    "item_instance_id": "TPL.MEASLENGTH.CONVERT.M.TO.CM.001#v1#00004",
    "language": "en-IN",
    "locale": "en-IN",
    "question_type": "numeric_entry",
    "simplest_form_only": false,
    "skill_ids": [
      "MEAS.LENGTH.UNITS"
    ],
    "solution_steps": {
      "canonical": [
        "Every metre is 100 centimetres.",
        "5 x 100 = the rope's length in cm."
      ]
    },
    "stem": "A rope is 5 metres long. Since 1 metre = 100 centimetres, how long is the rope in centimetres?",
    "template_id": "TPL.MEASLENGTH.CONVERT.M.TO.CM.001",
    "template_version": "1.0.0",
    "variables": {
      "m": 5
    },
    "variant_signature": "c35c98f84a330f51d2a6219a18afd0e5bc8c9c7471103bec428c1bba46f42ca1"
  },
  {
    "answer": "600",
    "bank_version": "v1",
    "difficulty": 0.2,
    "distractors": [],
    "figures": null,
    "graph_version": "1.0.0",
    "hints": [
      "How many centimetres are in 1 metre?",
      "Multiply the number of metres by 100."
    ],
    "item_instance_id": "TPL.MEASLENGTH.CONVERT.M.TO.CM.001#v1#00005",
    "language": "en-IN",
    "locale": "en-IN",
    "question_type": "numeric_entry",
    "simplest_form_only": false,
    "skill_ids": [
      "MEAS.LENGTH.UNITS"
    ],
    "solution_steps": {
      "canonical": [
        "Every metre is 100 centimetres.",
        "6 x 100 = the rope's length in cm."
      ]
    },
    "stem": "A rope is 6 metres long. Since 1 metre = 100 centimetres, how long is the rope in centimetres?",
    "template_id": "TPL.MEASLENGTH.CONVERT.M.TO.CM.001",
    "template_version": "1.0.0",
    "variables": {
      "m": 6
    },
    "variant_signature": "858c375ce38b206f1056894ae200670de401f9b4d7e2c064751d3d5edfef6c8e"
  },
  {
    "answer": "700",
    "bank_version": "v1",
    "difficulty": 0.2,
    "distractors": [],
    "figures": null,
    "graph_version": "1.0.0",
    "hints": [
      "How many centimetres are in 1 metre?",
      "Multiply the number of metres by 100."
    ],
    "item_instance_id": "TPL.MEASLENGTH.CONVERT.M.TO.CM.001#v1#00006",
    "language": "en-IN",
    "locale": "en-IN",
    "question_type": "numeric_entry",
    "simplest_form_only": false,
    "skill_ids": [
      "MEAS.LENGTH.UNITS"
    ],
    "solution_steps": {
      "canonical": [
        "Every metre is 100 centimetres.",
        "7 x 100 = the rope's length in cm."
      ]
    },
    "stem": "A rope is 7 metres long. Since 1 metre = 100 centimetres, how long is the rope in centimetres?",
    "template_id": "TPL.MEASLENGTH.CONVERT.M.TO.CM.001",
    "template_version": "1.0.0",
    "variables": {
      "m": 7
    },
    "variant_signature": "11019132d9ab6ef03c93a7952c61490dffea7f0cbf28d794246986ec182bb793"
  },
  {
    "answer": "800",
    "bank_version": "v1",
    "difficulty": 0.2,
    "distractors": [],
    "figures": null,
    "graph_version": "1.0.0",
    "hints": [
      "How many centimetres are in 1 metre?",
      "Multiply the number of metres by 100."
    ],
    "item_instance_id": "TPL.MEASLENGTH.CONVERT.M.TO.CM.001#v1#00007",
    "language": "en-IN",
    "locale": "en-IN",
    "question_type": "numeric_entry",
    "simplest_form_only": false,
    "skill_ids": [
      "MEAS.LENGTH.UNITS"
    ],
    "solution_steps": {
      "canonical": [
        "Every metre is 100 centimetres.",
        "8 x 100 = the rope's length in cm."
      ]
    },
    "stem": "A rope is 8 metres long. Since 1 metre = 100 centimetres, how long is the rope in centimetres?",
    "template_id": "TPL.MEASLENGTH.CONVERT.M.TO.CM.001",
    "template_version": "1.0.0",
    "variables": {
      "m": 8
    },
    "variant_signature": "8ce359044884c40e91ffc933648de7a9d2e9bd6c6490d514a7e495b0229bbceb"
  },
  {
    "answer": "900",
    "bank_version": "v1",
    "difficulty": 0.2,
    "distractors": [],
    "figures": null,
    "graph_version": "1.0.0",
    "hints": [
      "How many centimetres are in 1 metre?",
      "Multiply the number of metres by 100."
    ],
    "item_instance_id": "TPL.MEASLENGTH.CONVERT.M.TO.CM.001#v1#00008",
    "language": "en-IN",
    "locale": "en-IN",
    "question_type": "numeric_entry",
    "simplest_form_only": false,
    "skill_ids": [
      "MEAS.LENGTH.UNITS"
    ],
    "solution_steps": {
      "canonical": [
        "Every metre is 100 centimetres.",
        "9 x 100 = the rope's length in cm."
      ]
    },
    "stem": "A rope is 9 metres long. Since 1 metre = 100 centimetres, how long is the rope in centimetres?",
    "template_id": "TPL.MEASLENGTH.CONVERT.M.TO.CM.001",
    "template_version": "1.0.0",
    "variables": {
      "m": 9
    },
    "variant_signature": "c94e872c954deac99ba79fa2ff4e1d4f1df273c35a8326ece27c6bac2a984429"
  }
]
